{
  "schema_version": "commerce_order.v1",
  "seller_id": "seller-a",
  "order_id": "order-002",
  "customer_id_local": "buyer-17",
  "idempotency_key": "request-def",
  "status": "completed",
  "status_version": 3,
  "created_at": "2026-09-22T03:00:00Z",
  "completed_at": "2026-09-22T03:05:00Z",
  "cancelled_at": null,
  "currency": "KRW",
  "items": [
    {
      "item_id_local": "item-42",
      "quantity": 2,
      "unit_price_minor": 3500
    },
    {
      "item_id_local": "item-07",
      "quantity": 1,
      "unit_price_minor": 12000
    }
  ]
}
