{
  "schema_version": "commerce_order.v1",
  "seller_id": "seller-a",
  "order_id": "order-001",
  "customer_id_local": "buyer-17",
  "idempotency_key": "request-abc",
  "status": "requested",
  "status_version": 1,
  "created_at": "2026-09-22T03:00:00Z",
  "completed_at": null,
  "cancelled_at": null,
  "currency": "KRW",
  "items": [
    {
      "item_id_local": "item-42",
      "quantity": 2,
      "unit_price_minor": 3500
    }
  ]
}
